{
  "$schema": "https://json-schema.org/draft/2020-12/schema",
  "title": "Stratagem Trainer configuration pack",
  "description": "UTF-8 JSON, at most 1 MiB. The application additionally checks unique stratagem IDs and actual calendar dates.",
  "type": "object",
  "additionalProperties": false,
  "required": ["schemaVersion", "id", "name", "kind", "stratagems"],
  "properties": {
    "schemaVersion": { "const": 1 },
    "id": { "$ref": "#/$defs/id" },
    "name": { "$ref": "#/$defs/name" },
    "description": { "$ref": "#/$defs/text", "maxLength": 1000 },
    "kind": { "enum": ["base", "warbond", "custom"] },
    "source": { "$ref": "#/$defs/sources" },
    "verifiedAt": { "type": "string", "pattern": "^\\d{4}-\\d{2}-\\d{2}(?:T\\d{2}:\\d{2}:\\d{2}(?:\\.\\d{1,3})?(?:Z|[+-]\\d{2}:\\d{2}))?$" },
    "releaseDate": { "type": "string", "format": "date" },
    "notes": { "$ref": "#/$defs/text", "maxLength": 4000 },
    "stratagems": {
      "type": "array",
      "minItems": 0,
      "maxItems": 500,
      "items": { "$ref": "#/$defs/stratagem" }
    }
  },
  "$defs": {
    "id": {
      "type": "string",
      "maxLength": 64,
      "pattern": "^[a-zA-Z0-9]+(?:[-_][a-zA-Z0-9]+)*$",
      "not": { "enum": ["__proto__", "prototype", "constructor"] }
    },
    "text": {
      "type": "string",
      "minLength": 1,
      "pattern": "^(?!\\s)(?!.*[<>\\u0000-\\u001f\\u007f-\\u009f\\u202a-\\u202e\\u2066-\\u2069]).*[^\\s]$|^[^\\s<>\\u0000-\\u001f\\u007f-\\u009f\\u202a-\\u202e\\u2066-\\u2069]$"
    },
    "name": { "$ref": "#/$defs/text", "maxLength": 120 },
    "sources": {
      "type": "array",
      "maxItems": 20,
      "items": { "type": "string", "maxLength": 2048, "format": "uri", "pattern": "^https?://[^\\s]+$" }
    },
    "stratagem": {
      "type": "object",
      "additionalProperties": false,
      "required": ["id", "name", "sequence"],
      "properties": {
        "id": { "$ref": "#/$defs/id" },
        "name": { "$ref": "#/$defs/name" },
        "sequence": {
          "type": "array",
          "minItems": 1,
          "maxItems": 16,
          "items": { "enum": ["up", "down", "left", "right"] }
        },
        "category": { "$ref": "#/$defs/text", "maxLength": 80 },
        "tags": { "type": "array", "maxItems": 20, "items": { "$ref": "#/$defs/text", "maxLength": 40 } },
        "source": { "$ref": "#/$defs/sources" }
      }
    }
  }
}
