{
  "schemaVersion": 1,
  "id": "obedient-democracy-support-troopers",
  "name": "Obedient Democracy Support Troopers",
  "kind": "warbond",
  "description": "No new stratagem call-in codes in this Warbond.",
  "releaseDate": "2025-08-26",
  "verifiedAt": "2026-10-12",
  "source": [
    "https://blog.playstation.com/?p=408548",
    "https://helldivers.wiki.gg/wiki/Warbonds",
    "https://helldivers.wiki.gg/wiki/Stratagems"
  ],
  "notes": "Helldivers 2 x Halo: ODST. Weapons and cosmetics, with no new stratagem call-in sequence.",
  "stratagems": []
}
