{
  "schemaVersion": 1,
  "id": "steeled-veterans",
  "name": "Steeled Veterans",
  "kind": "warbond",
  "description": "No new stratagem call-in codes in this Warbond.",
  "releaseDate": "2024-02-08",
  "verifiedAt": "2026-10-12",
  "source": [
    "https://blog.playstation.com/2023/09/14/helldivers-2-launches-february-8-2024/",
    "https://helldivers.wiki.gg/wiki/Warbonds",
    "https://helldivers.wiki.gg/wiki/Stratagems"
  ],
  "notes": "This released Warbond contains no stratagem call-in codes. Its weapons, armor, boosters and cosmetics are not directional call-ins.",
  "stratagems": []
}
