{
  "schemaVersion": 1,
  "id": "viper-commandos",
  "name": "Viper Commandos",
  "kind": "warbond",
  "description": "No new stratagem call-in codes in this Warbond.",
  "releaseDate": "2024-06-13",
  "verifiedAt": "2026-10-12",
  "source": [
    "https://blog.playstation.com/2024/06/06/helldivers-ii-enlists-the-viper-commandos-warbond-on-june-13/",
    "https://helldivers.wiki.gg/wiki/Warbonds",
    "https://helldivers.wiki.gg/wiki/Stratagems"
  ],
  "notes": "This released Warbond contains no stratagem call-in codes. Its weapons, armor, boosters and cosmetics are not directional call-ins.",
  "stratagems": []
}
