{
  "schemaVersion": 1,
  "id": "democratic-detonation",
  "name": "Democratic Detonation",
  "kind": "warbond",
  "description": "No new stratagem call-in codes in this Warbond.",
  "releaseDate": "2024-04-11",
  "verifiedAt": "2026-10-12",
  "source": [
    "https://blog.playstation.com/2024/04/04/helldivers-2-gets-an-explosive-new-warbond-on-april-11/",
    "https://helldivers.wiki.gg/wiki/Warbonds",
    "https://helldivers.wiki.gg/wiki/Stratagems"
  ],
  "notes": "This released Warbond contains no stratagem call-in codes. Its weapons, armor, boosters and cosmetics are not directional call-ins.",
  "stratagems": []
}
