{
  "schemaVersion": 1,
  "id": "python-commandos",
  "name": "Python Commandos",
  "kind": "warbond",
  "description": "Stratagem call-in codes unlocked in this Warbond.",
  "releaseDate": "2025-12-02",
  "verifiedAt": "2026-10-12",
  "source": [
    "https://blog.playstation.com/2025/11/25/helldivers-2-python-commandos-premium-warbond-airdrops-dec-2/",
    "https://helldivers.wiki.gg/wiki/Warbonds",
    "https://helldivers.wiki.gg/wiki/Stratagems"
  ],
  "notes": "Directional codes verified from the linked community sources.",
  "stratagems": [
    {
      "id": "ax-flam-75-hot-dog",
      "name": "AX/FLAM-75 Hot Dog",
      "sequence": [
        "down",
        "up",
        "left",
        "up",
        "left",
        "left"
      ],
      "category": "supply",
      "source": [
        "https://helldivers.wiki.gg/wiki/AX%2FFLAM-75_Hot_Dog",
        "https://raw.githubusercontent.com/k33bs/Helldivers-2-Stratagem-JSON-Generator/eda04ed2f6a7a97f7253c21454f2926cf7c26c3f/sequences.json"
      ]
    },
    {
      "id": "cqc-9-defoliation-tool",
      "name": "CQC-9 Defoliation Tool",
      "sequence": [
        "down",
        "left",
        "right",
        "right",
        "down"
      ],
      "category": "supply",
      "source": [
        "https://helldivers.wiki.gg/wiki/CQC-9_Defoliation_Tool",
        "https://raw.githubusercontent.com/k33bs/Helldivers-2-Stratagem-JSON-Generator/eda04ed2f6a7a97f7253c21454f2926cf7c26c3f/sequences.json"
      ]
    },
    {
      "id": "m-1000-maxigun",
      "name": "M-1000 Maxigun",
      "sequence": [
        "down",
        "left",
        "right",
        "down",
        "up",
        "up"
      ],
      "category": "supply",
      "source": [
        "https://helldivers.wiki.gg/wiki/M-1000_Maxigun",
        "https://raw.githubusercontent.com/k33bs/Helldivers-2-Stratagem-JSON-Generator/eda04ed2f6a7a97f7253c21454f2926cf7c26c3f/sequences.json"
      ]
    }
  ]
}
